Titre;Auteur;Infos biblios;Créateur / Éditeur;Sujet;Collection;Édition;Langue;ISBN;ISBN (13);ISSN
Ce que je crois  ;Hervé , Pierre , historien ;Ce que je crois [Texte imprimé] / Pierre Hervé;Hervé , Pierre , historien (Paris : B. Grasset (impr. de Chantenay), 1958);;;;Français;;;
"Le retour à la nature : ""au fond de la forêt...l'État"" ";Hervieu-Léger , Danièle ;"Le retour à la nature : ""au fond de la forêt...l'État"" / Danièle Léger et Bertrand Hervieu";Hervieu-Léger , Danièle (Paris : Éd. du Seuil, DL 1979);Communautés   Écologisme   Sociologie rurale  et autres;;;Français;2-02-005179-6 ;9782020051798 ;
Kilts et tartans  ;Hesketh , Christian ;"Kilts et tartans [Texte imprimé] / Christian Hesketh ; texte français de Claude Pagani";Hesketh , Christian (Paris : Hachette, 1964);Kilts   Tartan (tissu) ;Plaisir des images;;Français;;;
De Freud à Lacan  ;Hesnard , Angelo ;De Freud à Lacan [Texte imprimé] / par le Dr A. Hesnard, ...;Hesnard , Angelo (Paris : Éditions ESF, c1971);Freud, Sigmund   Lacan, Jacques   Psychanalyse  et autres;Horizons de la psychologie;2e édition;Français;;;
Narcisse et Goldmund ;Hesse , Hermann ;"Narcisse et Goldmund / Hermann Hesse ; récit traduit de l'allemand par Fernand Delmas";Hesse , Hermann (Paris : Librairie générale française, 1978);Roman allemand -- 20e siècle -- Traductions françaises ;"Le Livre de poche ; 1583";;Français;978-2-253-00004-4  et autres;978-2-253-00004-4  et autres;
Les découvertes  ;Hesse , Roland ;"Les découvertes [Texte imprimé] / Roland Hesse ; préface de Max-Pol Fouchet";Hesse , Roland (Paris : Editions Saint-Germain-des-Prés, D.L 1978);;Chemins profonds;;Français;;;
Pour une psychiatrie communautaire : (thèses pour une psychiatrie des ensembles) ;Hochmann , Jacques ;"Pour une psychiatrie communautaire : (thèses pour une psychiatrie des ensembles) / Jacques Hochmann ; préface de G. Daumézon";Hochmann , Jacques (Paris : Éditions du Seuil, DL1971);Psychiatrie   Psychiatrie communautaire   Hôpitaux psychiatriques  et autres;Esprit . La Cité prochaine;;Français;;;
Le nègre romantique  : personnage littéraire et obsession collective ;Hoffmann , Léon François ;Le nègre romantique [Texte imprimé] : personnage littéraire et obsession collective / Léon-François Hoffmann;"Hoffmann , Léon François (Paris : Payot, 1973 ;  18-Saint-Amand :  impr. Bussière)";Littérature française -- 19e siècle   Thèmes, motifs   Noirs  et autres;Le regard de l'histoire;;Français;2-228-27140-3 ;9782228271400 ;
Nuances et détails  = (Nuancen und Details) ;Hohl , Ludwig ;"Nuances et détails [Texte imprimé] = (Nuancen und Details) / Ludwig Hohl ; trad. de l'allemand par Etienne Barilier";Hohl , Ludwig (Lausanne : Editions de l'Aire, impr. 1984);;Lettres universelles;;Français;;;
L'oeuvre de Søren Kierkegaard  : le chemin du solitaire ;Hohlenberg , Johannes Edouard ;"L'oeuvre de Søren Kierkegaard [Texte imprimé] : le chemin du solitaire / Johannes Hohlenberg ; trad. du danois par P.-H. Tisseau";Hohlenberg , Johannes Edouard (Paris : Albin Michel, 1960);Kierkegaard, Søren -- 1813-1855 ;;;Français;;;
La prise de la Concorde : essais sur Georges Bataille ;Hollier , Denis ;La prise de la Concorde : essais sur Georges Bataille / Denis Hollier;Hollier , Denis ([Paris} : Gallimard, DL 1974);Bataille, Georges   Architecture et littérature   Architecture and literature  et autres;"Le Chemin ; [117]";;Français;2-07-028962-1 ;9782070289622 ;
Un des problèmes de la paix  : le désarmement de l'Allemagne : textes et documents ;Honnorat , André ;Un des problèmes de la paix [Texte imprimé] : le désarmement de l'Allemagne : textes et documents / André Honnorat, ...;Honnorat , André (Paris : A. Costes, 1924);Allemagne   Et le désarmement ;"Publications de la Société de l'histoire de la guerre ; 3e série";;Français;;;
Horace  ;Horace ;Horace [Texte imprimé] / Leconte de Lisle;Horace (Paris : A. Lemerre, [1911]);;;Traduction nouvelle;Français;;;
La dialectique de la raison  : fragments philosophiques ;Horkheimer , Max ;"La dialectique de la raison [Texte imprimé] : fragments philosophiques / Max Horkheimer, Theodor W. Adorno ; traduit de [la 2e éd. allemande]... par Éliane Kaufholz";"Horkheimer , Max ([Paris] : Gallimard, impr. 1974 ;  27-Mesnil-sur-l'Estrée :  Impr. Firmin-Didot)";Raison   Dialectique   Criticisme ;"Bibliothèque des idées ; 92";;Français;;;
Théorie traditionnelle et théorie critique  ;Horkheimer , Max ;"Théorie traditionnelle et théorie critique [Texte imprimé] / par Max Horkheimer ; traduit de l'allemand par Claude Maillard et Sibylle Muller";"Horkheimer , Max ([Paris] : Gallimard, 1974 ;  27-Mesnil-sur-l'Estrée :  impr. Firmin-Didot)";École de Francfort ;"Les Essais ; 189";;Français;;;
L'auto-analyse  ;Horney , Karen ;"L'auto-analyse [Texte imprimé] / Karen Horney ; [trad. de l'anglais par Dominique Maroger]";Horney , Karen ([Paris] : Ed. Gonthier, 1966);Autoanalyse ;"Femme ; 16";;Français;;;
Nos conflits intérieurs ;Horney , Karen ;"Nos conflits intérieurs / Karen Horney ; traduit de l'anglais par Jean Paris";Horney , Karen (Paris : L'Arche, DL 1955);Troubles de la personnalité   Névroses   Conflit (psychologie) ;Collection Psyché;;Français;;;
Embryologie ;Houillon , Charles ;Embryologie / Charles Houillon;"Houillon , Charles (Paris : Hermann ; C 1967)";"Embryology   Embryologie   Manuels d&apos;enseignement supérieur ";"Collection Méthodes .- Introduction à la biologie ; 5";;Français;2-7056-5564-6 ;9782705655648 ;
Sexualité  ;Houillon , Charles ;Sexualité [Texte imprimé] / Charles Houillon;Houillon , Charles (Paris : Hermann, DL 1972);Sexualité (biologie)   Reproduction   Sexualité ;Méthodes;3e tirage corrigé;Français;2-7056-2169-5 ;9782705621698 ;
Tunisie  ;Houlet , Gilbert ;Tunisie [Texte imprimé] / [ par Gilbert Houlet];Houlet , Gilbert (Paris : Hachette, 1967);Tunisie   Guides ;Les guides bleus illustrés;;Français;;;
Du rituel à la scène chez les Bassa du Cameroun ;Hourantier , Marie-José ;Du rituel à la scène chez les Bassa du Cameroun / [textes recueillis et présentés par] Marie-José Hourantier, Werewere Liking, Jacques Scherer;Hourantier , Marie-José (Paris : A.-G. Nizet, 1979);Théâtre   Cameroun   Médecine et ésotérisme  et autres;;;Français;;;
Victoria Regina  ;Housman , Laurence ;"Victoria Regina [Texte imprimé] / Laurence Housman ; adapté de l'anglais par André Maurois et par Virginia Vernon ; dessins de E.H. Shepard";Housman , Laurence (Paris : Plon, D.L 1937);;;;Français;;;
1815  : la première restauration, le retour de l'ile d'Elbe, les Cent jours ;Houssaye , Henry ;1815 [Mille huit cent quinze] [Texte imprimé] : la première restauration, le retour de l'ile d'Elbe, les Cent jours / par Henry Houssaye;Houssaye , Henry (Paris : Perrin, 1933);France -- 1814-1815 ;;81e éd.;Français;;;
Les Nuits féodales  : tribulations d'un Persan au Moyen-Orient : récit ;Hoveyda , Fereydoun ;Les Nuits féodales [Texte imprimé] : tribulations d'un Persan au Moyen-Orient : récit / Fereydoun Hoveyda;"Hoveyda , Fereydoun (Paris : Scarabée : A.-M. Métailié, 1DL983 ;  18-Saint-Amand-Montrond :  Impr. S.E.P.C.)";Hoveyda, Fereydoun -- 1924-.... ;;;Français;2-86722-002-5 ;9782867220029 ;
Les Neiges du Sinaï  ;Hoveyda , Fereydoun ;Les Neiges du Sinaï [Texte imprimé] / Fereydoun Hoveyda;"Hoveyda , Fereydoun ([Paris] : Gallimard, 1973 ;  86-Ligugé :  impr. Aubin)";;;;Français;2-07-028537-5 ;9782070285372 ;
Un Temps pour rien  ;Howlett , Jacques ;Un Temps pour rien [Texte imprimé] / Jacques Howlett;Howlett , Jacques (Paris : Plon, impr. 1953);;Roman;;Français;;;
Le Théâtre des opérations  : roman ;Howlett , Jacques ;Le Théâtre des opérations [Texte imprimé] : roman / Jacques Howlett;Howlett , Jacques (Paris : Buchet-Chastel-Corrêa, 1959);;;;Français;;;
L'Énigme et le délire  ;Huber , Gérard ;L'Énigme et le délire [Texte imprimé] / Gérard Huber;"Huber , Gérard ([Paris] : Osiris, 1988 ;  79-Niort :  Impr. Soulisse et Cassegrain)";Psychanalyse et philosophie   Shoah   Socioanalyse  et autres;;;Français;2-905460-14-8 ;9782905460141 ;
Charlie Chaplin  ;Huff , Théodore ;"Charlie Chaplin [Texte imprimé] / Théodore Huff ; trad. de l'américain par Pierre Singer";Huff , Théodore (Paris : Gallimard, impr. 1953);Chaplin, Charles -- 1889-1977 ;;;Français;;;
Le Regard de la mémoire  ;Hugo , Jean ;"Le Regard de la mémoire [Texte imprimé] / Jean Hugo ; préf. de Raymond Jean ; lecture de Victor Bol";"Hugo , Jean (Arles : Actes Sud ; [Bruxelles ] : Labor, 1989 ;  18-Saint-Amand-Montrond :  Impr. Bussière)";Hugo, Jean   Vie artistique   France  et autres;"Babel ; 5";;Français;2-8040-0437-6  et autres;9782804004378  et autres;
L'œil de Moscou à Paris : 1922-1924 ;Humbert-Droz , Jules ;"L'œil de Moscou à Paris : 1922-1924 / Jules Humbert-Droz,... ; textes et notes établis avec la collaboration d'Annie Kriegel";"Humbert-Droz , Jules ([Paris] : René Julliard ; C 1964)";Internationale -- 03   Parti communiste français -- 1920-1939   Parti communiste français  et autres;"Collection Archives ; 2";;Français;;;
La Dévoration  ;Humeau , Cécile ;"La Dévoration [Texte imprimé] / Cécile Humeau ; dessins de Recondo";"Humeau , Cécile (Paris : P. Belfond, 1981 ;  92-Châtillon-sous-Bagneux :  Impr. SEG)";;Espaces;;Français;2-7144-1392-7 ;9782714413925 ;
Dear Henry  : récit ;Hunebelle , Danielle ;Dear Henry [Texte imprimé] : récit / Danielle Hunebelle;Hunebelle , Danielle ([Paris] : Gallimard, 1972);Kissinger, Henry -- 1923-.... ;;;Français;2-07-028269-4 ;9782070282692 ;
Papeles de condenado  ;Hurtado , Efrain ;Papeles de condenado [Texte imprimé] / Efrain Hurtado;Hurtado , Efrain ([Caracas] : Ateneo de Bocono, 1964);;Colección Los inéditos;;Espagnol;;;
Arabes et Israéliens, un premier dialogue  ;Hussein , Mahmoud ;Arabes et Israéliens, un premier dialogue [Texte imprimé] / Mahmoud Hussein, Saul Friedländer, Jean Lacouture;"Hussein , Mahmoud (Paris : Seuil, 1974 ;  27-Mesnil-sur-l'Estré :  impr. Firmin-Didot)";Conflit israélo-arabe -- 1967-1973   Conflits frontaliers israélo-arabes (1949-....)   Proche-Orient -- Relations extérieures  et autres;L'Histoire immédiate;;Français;;;
Les Malles  : roman ;Husson , Jean ;Les Malles [Texte imprimé] : roman / Jean Husson;Husson , Jean (Paris : Éditions du Seuil, 1958);;;;Français;;;
Les puissances de l'image : bilan d'une psychologie de l'art ;Huyghe , René ;Les puissances de l'image : bilan d'une psychologie de l'art / René Huyghe,...;Huyghe , René (Paris : Flammarion, DL 1965);"Art -- Philosophie   Psychologie de l&apos;art   Illustrations -- Interprétation  et autres";;;Français;2-08-010160-9 ;9782080101600 ;
Trois primitifs : les Grünewald du musée de Colmar, le Maître de Flémalle et la Florentine du musée de Francfort-sur-le-Main ;Huysmans , Joris-Karl ;Trois primitifs : les Grünewald du musée de Colmar, le Maître de Flémalle et la Florentine du musée de Francfort-sur-le-Main / J. K. Huysmans;Huysmans , Joris-Karl (Paris : Arts et métiers graphiques : Flammarion, DL 1967);Grünewald, Matthias   Maître de Flémalle   Bartolomeo Veneto  et autres;Images et idées;;Français;;;
Félicien Rops ;Huysmans , Joris-Karl ;Félicien Rops / Joris-Karl Huysmans;Huysmans , Joris-Karl (La Rochelle : Rumeur des Ages, copyright 1998);Rops, Félicien   Critique et interprétation -- 1833-1898 ;Passage à parole;;Français;2-84327-025-1 ;9782843270253 ;
Regard sur le temps des soufis : vie des saints du sud marocain des Ve, VIe, VIIe siècles de l'Hégire ;Ibn al-Zayy?t , Y?suf ibn Ya?yá al-T?dil? Ab? Ya?q?b ;"Regard sur le temps des soufis : vie des saints du sud marocain des Ve, VIe, VIIe siècles de l'Hégire / Ibn al Zayyât al Tâdilî ; texte arabe établi, annoté et présenté par Ahmed Toufiq ; trad. de l'arabe par Maurice de Fenoyl";"Ibn al-Zayy?t , Y?suf ibn Ya?yá al-T?dil? Ab? Ya?q?b ([Casablanca] : EDDIF ; Paris : Unesco, impr. 1995, cop. 1995)";Muslim saints -- Africa, North -- Biography   Sufis -- Morocco -- Biography   Saints musulmans  et autres;Collection Unesco d'oeuvres représentatives;;Français;2-908801-61-2  et autres;9782908801613  et autres;
Histoire des Berbères et des dynasties musulmanes de l'Afrique septentrionale . Tome I-IV ;Ibn H?ald?n , ?Abd al-Ra?mân ibn Mu?ammad ;"Histoire des Berbères et des dynasties musulmanes de l'Afrique septentrionale . Tome I-IV / Ibn Khaldoun ; traduite de l'arabe par le baron de Slane,...";Ibn H?ald?n , ?Abd al-Ra?mân ibn Mu?ammad (Paris : P. Geuthner, 1925-1956);Berbères   Histoire   Afrique du Nord -- 647-1517  et autres;;Nouvelle  édition;Français;;;
Discours sur l'histoire universelle ;Ibn H?ald?n , ?Abd al-Ra?mân ibn Mu?ammad ;"Discours sur l'histoire universelle / Ibn Khaldûn ; traduction nouvelle, préface et notes par Vincent Monteil ; [publ. par la] Commission libanaise pour la traduction des chefs-d'œuvre";"Ibn H?ald?n , ?Abd al-Ra?mân ibn Mu?ammad (Paris : Sindbad, DL 1978 ; 18-Bourges : Impr. Tardy-Quercy)";"Historiographie   Philosophie de l&apos;histoire   Histoire universelle ";;2e éd. revue;Français;2-7274-0031-4  et autres;9782727400318  et autres;
Molière double ;Ikor , Roger ;Molière double / Roger Ikor;Ikor , Roger ([Paris] : Presses universitaires de France, DL 1977);Molière   Critique et interprétation -- 20e siècle -- 1622-1673 ;Littératures;;Français;;;
Lettre ouverte à de gentils terroristes  ;Ikor , Roger ;Lettre ouverte à de gentils terroristes [Texte imprimé] / Roger Ikor;"Ikor , Roger (Paris : A. Michel, 1976 ;  27-Mesnil-sur-l'Estrée :  impr. Firmin-Didot)";Terrorisme ;Collection Lettre ouverte;;Français;2-226-00296-0 ;9782226002969 ;
Mise au net  : pour une révolution de la discrétion ;Ikor , Roger ;Mise au net [Texte imprimé] : pour une révolution de la discrétion / Roger Ikor;Ikor , Roger (Paris : A. Michel, [1957]);Littérature française   Histoire et critique ;;;Français;;;
Énergie et équité  ;Illich , Ivan ;"Énergie et équité [Texte imprimé] / Ivan Illich ; version française en collaboration avec Luce Giard et Vincent Bardet";"Illich , Ivan (Paris : Éditions du Seuil, 1973 ;  27-Mesnil :  impr. Firmin-Didot)";Technique et civilisation   Énergie   Transport  et autres;;;Français;;;
Le travail fantôme  ;Illich , Ivan ;"Le travail fantôme [Texte imprimé] / Ivan Illich ; traduit de l'anglais par Maud Sissung";"Illich , Ivan (Paris : Éd. du Seuil, DL 1981 ;  18-Saint-Amand :  Impr. S.E.P.C.)";Économie domestique   Travail   Aspect social  et autres;;;Français;2-02-005803-0 ;9782020058032 ;
Libérer l'avenir  : appel à une révolution des institutions ;Illich , Ivan ;"Libérer l'avenir [Texte imprimé] : appel à une révolution des institutions / Ivan D. Illich ; traduit de l'anglais par Gérard Durand ; introduction d'Erich Fromm";Illich , Ivan (Paris : Éd. du Seuil, DL 1971);Civilisation -- 20e siècle   Changement social ;;;Français;2-02-000611-1 ;9782020006118 ;
Le Pouvoir, les juges et les bourreaux ;Imbert , Jean ;Le Pouvoir, les juges et les bourreaux / Jean Imbert,... Georges Levasseur,...;"Imbert , Jean ([Paris] : Hachette ; C 1972)";Droit pénal   Juges   Punition  et autres;Hachette littérature;;Français;;;
Le corps tabou  ;Internationale de l'imaginaire ;Le corps tabou [Texte imprimé] / Internationale de l'imaginaire;"Internationale de l'imaginaire (Périodique) (Paris : Maison des cultures du monde ; Arles : Babel, 1998, cop. 1998 ;  18-Saint-Amand :  Impr. Bussière)";Aspect religieux   Corps humain -- Anthropologie   Corps humain  et autres;"Babel ; 303";;Français;2-7427-1453-7 ;9782742714537 ;
Deux millénaires et après  ;Internationale de l'imaginaire ;Deux millénaires et après [Texte imprimé] / Internationale de l'imaginaire;"Internationale de l'imaginaire (Périodique) (Paris : Maison des cultures du monde ; Arles : Babel, impr.1998 ;  18-Saint-Amand-Montrond :  Bussière Camedan impr.)";Vingtième siècle   An 2000   Civilisation -- 1950-.... ;"Babel ; 342 .- L'Internationale de l'imaginaire ; 9";;Français;2-7427-1891-5 ;9782742718917 ;
Entre la vie et le rêve  : entretiens avec Claude Bonnefoy ;Ionesco , Eugène ;Entre la vie et le rêve [Texte imprimé] : entretiens avec Claude Bonnefoy / Eugène Ionesco;Ionesco , Eugène (Paris : Gallimard, 1996);Ionesco, Eugène   Entretiens -- 1909-1994 ;Les Cahiers de la NRF;;Français;2-07-074627-5 ;9782070746279 ;
Journal en miettes  ;Ionesco , Eugène ;Journal en miettes [Texte imprimé] / Eugène Ionesco;Ionesco , Eugène (Paris : Mercure de France, impr. 1967);;;;Français;;;
Ce sexe qui n'en est pas un  ;Irigaray , Luce ;Ce sexe qui n'en est pas un [Texte imprimé] / Luce Irigaray;"Irigaray , Luce (Paris : Éd. de Minuit, 1977 ;  53-Mayenne :  impr. Floch)";Différences entre sexes (psychologie)   Sexualité (psychologie)   Féminité (psychologie)  et autres;"Critique ; 26";;Français;2-7073-0155-8 ;9782707301550 ;
Speculum : de l'autre femme ;Irigaray , Luce ;Speculum : de l'autre femme / Luce Irigaray;"Irigaray , Luce (Paris : Les Éditions de Minuit ; C 1974)";Différences entre sexes (psychologie)   Sex (Psychology)   Psychanalyse et femmes  et autres;"Collection ""Critique""";;Français;2-7073-0024-1  et autres;9782707300249  et autres;
La palabra desalienada  ;Isaacson , José ;La palabra desalienada [Texte imprimé] / Jose Isaacson;Isaacson , José (Buenos Aires : Comentario, [19..]);Poétique ;;;Espagnol;;;
Euzkadi socialiste  ;Isaba , Patxi ;Euzkadi socialiste [Texte imprimé] / Patxi Isaba;Isaba , Patxi ([Paris, ] : Éditions du Cercle : Éditions de la Tête de feuilles, 1971);Pays basque (Espagne) -- 20e siècle   Pays basque -- Histoire -- Autonomie et mouvements indépendantistes ;Changer le monde;;Français;;;
D'une image à l'autre  : la représentation dans le cinéma d'aujourd'hui ;Ishaghpour , Youssef ;D'une image à l'autre [Texte imprimé] : la représentation dans le cinéma d'aujourd'hui / Youssef Ishaghpour;Ishaghpour , Youssef (Paris : Denoël : Gonthier, impr. 1981, cop. 1982);Modernisme (esthétique)   Cinéma -- Théorie   Cinéma -- Thèmes, motifs  et autres;"Bibliothèque Médiations ; 215";;Français;2-282-30215-X ;9782282302157 ;
Luchino Visconti : le sens et l'image ;Ishaghpour , Youssef ;Luchino Visconti : le sens et l'image / Youssef Ishaghpour;"Ishaghpour , Youssef (Paris : Éd. de la Différence, impr. 1984 ;  25-Baume-les-Dames :  Impr. moderne de l'Est)";Visconti, Luchino   Technique -- 1906-1976 -- Critique et interprétation -- 1906-1976 ;Essais;;Français;2-7291-0156-X ;9782729101565 ;
Le procès Robert Brasillach (19 janvier 1945) ;Isorni , Jacques ;Le procès Robert Brasillach (19 janvier 1945) / Jacques Isorni;Isorni , Jacques (Paris : Flammarion, [1946]);Brasillach, Robert -- 1909-1945 ;;;Français;;;
Introduction à une nouvelle conception de la science  : la chorismatique, la dusarestique, la diatasique et la toméique des domaines préoccupés de la réalité objective ;Isou , Isidore ;Introduction à une nouvelle conception de la science [Texte imprimé] : la chorismatique, la dusarestique, la diatasique et la toméique des domaines préoccupés de la réalité objective / Isidore Isou;Isou , Isidore (Paris : Lettrisme, D.L 1973);;;;Français;;;
Heureux comme Dieu en France... 1940-1944 ;Israël , Gérard ;Heureux comme Dieu en France... 1940-1944 / Gérard Israël;"Israël , Gérard (Paris : Éditions Robert Laffont, DL 1975 ; 27-Évreux : impr. Hérissey)";Juifs, France, 1940-1944   Guerre mondiale (1939-1945) -- Juifs   Juifs -- France  et autres;"Collection Vécu ; 63";;Français;;;
La vie de Bakounine  ;Iswolsky , Hélène ;La vie de Bakounine [Texte imprimé] / par Hélène Iswolsky;Iswolsky , Hélène (Paris : Gallimard, 1930);Bakounine, Mikhail Aleksandrovitch -- 1814-1876 ;"Vie des hommes illustres ; 44";;Français;;;
La pulsion de mort chez Melanie Klein ;Jaccard , Roland ;La pulsion de mort chez Melanie Klein / Roland Jaccard;"Jaccard , Roland (Lausanne : Éditions l'Âge d'homme ; [Paris] : [diffusion F. Maspero], 1971 ;  Dole :  Presses jurassiennes)";Klein, Melanie   Pulsion de mort   Death -- Psychological aspects -- Critique et interprétation -- 1882-1960 ;Collection Sphinx;;Français;;;
L'obscurité  : récit ;Jaccottet , Philippe ;L'obscurité [Texte imprimé] : récit / Philippe Jaccottet;Jaccottet , Philippe (Paris : Gallimard, impr. 1961);;;;Français;;;
Éléments d'un songe ;Jaccottet , Philippe ;Éléments d'un songe / Philippe Jaccottet;Jaccottet , Philippe (Paris : Gallimard, DL 1961);;;;Français;2-07-023331-6 ;9782070233311 ;
La logique du vivant  : une histoire de l'hérédité ;Jacob , François ;La logique du vivant [Texte imprimé] : une histoire de l'hérédité / François Jacob;Jacob , François (Paris : Gallimard, DL 1976);Génétique   Hérédité   Biologie  et autres;"Collection Tel ; 2";;Français;978-2-07-029334-6  et autres;978-2-07-029334-6  et autres;
Hébert : le Père Duchesne, chef des sans-culottes ;Jacob , Louis , historien ;Hébert : le Père Duchesne, chef des sans-culottes / Louis Jacob;"Jacob , Louis , historien (Paris : Gallimard, DL 1960 ;  Mayenne :  impr. Floch)";Hébert, Jacques-René   Hébert, Jacques René   France -- 1789-1799 (Révolution) -- Biographies -- 1757-1794 -- 1757-1794 ;Leurs figures;;Français;;;
Planant sur les airs  : roman ;Jacquemard , Simonne ;Planant sur les airs [Texte imprimé] : roman / Simonne Jacquemard;Jacquemard , Simonne (Paris : Gallimard, 1960);;;;Français;;;
Le mariage berbère  ;Jacquemard , Simonne ;Le mariage berbère [Texte imprimé] : [roman] / Simonne Jacquemard;Jacquemard , Simonne (Paris : Ed. du Seuil, 1975);;;;Français;;;
Des roses pour mes chevreuils  ;Jacquemard , Simonne ;Des roses pour mes chevreuils [Texte imprimé] / Simonne Jacquemard;Jacquemard , Simonne ([Paris] : Stock, 1974);Relations homme-animal   France ;Stock nature;;Français;2-234-00118-8 ;9782234001183 ;
Questions de poétique ;Jakobson , Roman ;"Questions de poétique / Roman Jakobson ; [publié sous la direction de Tzvetan Todorov]";Jakobson , Roman (Paris : Éditions du Seuil, DL 1973);Poetry   Poétique   Sémiotique et littérature  et autres;"Collection Poétique ; 9";;Français;2-02-002042-4 ;9782020020428 ;
Essais de linguistique générale ;Jakobson , Roman ;"Essais de linguistique générale / Roman Jakobson ; traduit de l'anglais et préfacé par Nicolas Ruwet";Jakobson , Roman ([Paris] : Editions de Minuit, cop. 1963);Linguistique structurale   Linguistique   Langues  et autres;"Points ; 17";;Français;;;
Apologie de Platon  : essais de métaphysique ;Jambet , Christian ;Apologie de Platon [Texte imprimé] : essais de métaphysique / Christian Jambet;"Jambet , Christian (Paris : B. Grasset, 1976 ;  27-Mesnil :  impr. Firmin-Didot)";Platon -- 0427?-0348? av. J.-C. ;Théoriciens;;Français;2-246-00412-8 ;9782246004127 ;
Ontologie de la révolution . 1 . L' ange : pour une cynégétique du semblant ;Jambet , Christian ;Ontologie de la révolution . 1 . L' ange : pour une cynégétique du semblant / Christian Jambet, Guy Lardreau;"Jambet , Christian (Paris : Bernard Grasset, DL 1976 ; Mesnil-sur-l'Estrée : Imprimerie Firmin-Didot)";Idéologie et langage   Révolutions -- Philosophie ;Figures;;Français;2-246-00305-9 ;9782246003052 ;
La Chute de l'empire soviétique : roman ;James , Donald ;"La Chute de l'empire soviétique : roman / Donald James ; traduit de l'anglais par Maud Sissung";James , Donald (Paris : S. Messinger, DL 1982);Roman anglais ;;;Français;2-86583-023-3 ;9782865830237 ;
Histoire sommaire de la pensée économique  ;James , Émile ;Histoire sommaire de la pensée économique [Texte imprimé] / Emile James, ...;James , Émile (Paris : Montchrestien, impr.1955);Économie politique -- Histoire ;;;Français;;;
Les Bostoniennes ;James , Henry ;"Les Bostoniennes / Henry James ; trad. de l'anglais par Jeanne Collin-Lemercier";James , Henry (Paris : Éditions Denoe??l, 1955);Roman américain ;;;Français;;;
Un autre Bernanos  ;Jamet , Henry ;Un autre Bernanos [Texte imprimé] / Henry Jamet;Jamet , Henry (Lyon : E. Vitte, 1959);Bernanos, Georges -- 1888-1948 ;Singuliers et mal connus;;Français;;;
L' économie des crises ;Janeway , Eliot ;"L' économie des crises / Eliot Janeway ; Tr. de l'anglais par Véronique Charaire";Janeway , Eliot (Paris : Robert Laffont, DL 1968);War -- Economic aspects   Politique et gouvernement -- États-Unis   United States -- Economic policy  et autres;Le monde qui se fait;;"Anglais; Français";;;
Le pur et l'impur ;Jankélévitch , Vladimir ;Le pur et l'impur / Vladimir Jankélévitch;Jankélévitch , Vladimir (Paris : Flammarion, DL 1978);Chasteté   Conscience   Pureté (philosophie) ;"Champs . Champ philosophique ; 37";;Français;978-2-08-081037-3  et autres;978-2-08-081037-3  et autres;
L'ironie ;Jankélévitch , Vladimir ;L'ironie / Vladimir Jankélévitch;Jankélévitch , Vladimir (Paris : Flammarion, DL 1979);Ironie ;"Champs ; 66";;Français;2-08-081066-9 ;9782080810663 ;
La Grèce antique et la vie grecque  : (Géographie, histoire, littérature, beaux-arts, vie publique, vie privée) ;Jardé , Auguste ;La Grèce antique et la vie grecque [Texte imprimé] : (Géographie, histoire, littérature, beaux-arts, vie publique, vie privée) / par A. Jardé ...;Jardé , Auguste (Paris : Delagrave, 1934);Grèce -- Civilisation   Grèce -- Histoire ;;6e éd.;Français;;;
Le nain jaune  ;Jardin , Pascal ;Le nain jaune [Texte imprimé] / Pascal Jardin;"Jardin , Pascal (Paris : Julliard, 1978 ;  27-Évreux :  Impr. SIMPED)";Jardin, Jean   Diplomates   France  et autres;;;Français;2-260-00132-7 ;9782260001324 ;
