Titre;Auteur;Infos biblios;Créateur / Éditeur;Sujet;Collection;Édition;Langue;ISBN;ISBN (13);ISSN
Une société d'étrangers  ;Packard , Vance ;"Une société d'étrangers [Texte imprimé] / Vance Packard ; préface d'Alfred Sauvy ; [trad. de l'américain par Martine Wiznitzer]";Packard , Vance (Paris : Calmann-Lévy, 1973);Structure sociale   Sociologie   États-Unis ;;;Français;;;
Critica letteraria e sociologia della letteratura  : note e rassegne ;Pagliano , Graziella ;Critica letteraria e sociologia della letteratura [Texte imprimé] : note e rassegne / Graziella Pagliano Ungari;"Pagliano , Graziella (Assisi ; Roma : Carucci, cop. 1971)";Critique   Sociologie de la littérature ;;;Italien;;;
Le Rêve et la raison : pour une révolution de la politique ;Paillet , Marc ;Le Rêve et la raison : pour une révolution de la politique / Marc Paillet;"Paillet , Marc (Paris : R. Laffont, 1977 ;  27-Mesnil :  impr. Firmin-Didot)";Science politique ;Libertés 2000;;Français;;;
Le manteau de cuir : roman ;Paillet , Marc ;Le manteau de cuir : roman / Marc Paillet;Paillet , Marc (Paris : A. Michel, c1977);Roman français ;;;Français;2-226-00508-0 ;9782226005083 ;
Le journalisme : fonctions et langages du quatrième pouvoir ;Paillet , Marc ;Le journalisme : fonctions et langages du quatrième pouvoir / Marc Paillet;Paillet , Marc ([Paris] : Denoël, impr. 1974, cop. 1974);Journalisme   Presse -- Objectivité   Télévision -- Influence  et autres;"Regards sur le monde ; 15";;Français;;;
Boum-Le-Grand  : village d'Iro ;Pairault , Claude ;Boum-Le-Grand [Texte imprimé] : village d'Iro / Claude Pairault;Pairault , Claude (Paris : Institut d'ethnologie, 1966);"Goula Iro (peuple d&apos;Afrique)   Ethnologie -- Tchad   Tchad  et autres";"Travaux et mémoires de l'institut d'ethnologie ; 73";;Français;;;
Lacan : le symbolique et l'imaginaire ;Palmier , Jean-Michel ;Lacan : le symbolique et l'imaginaire / Jean-Michel Palmier;Palmier , Jean-Michel (Paris : Éd. Universitaires, impr. 1969);Lacan, Jacques   Critique et interprétation -- 1901-1981 ;"Psychothèque ; 1";;Français;2-7113-0152-4 ;9782711301522 ;
Wilhelm Reich  : essai sur la naissance du freudo-marxisme ;Palmier , Jean-Michel ;Wilhelm Reich [Texte imprimé] : essai sur la naissance du freudo-marxisme / par Jean-Michel Palmier;Palmier , Jean-Michel (Paris : Union générale d'éditions, cop. 1969);Reich, Wilhelm   Psychanalyse et marxisme -- Critique et interprétation -- 1897-1957 ;"Le Monde en 10-18 ; 460";;Français;;;
L'Homme à l'odeur de poireau  ;Panafieu , Bruno de ;L'Homme à l'odeur de poireau [Texte imprimé] : [présenté par Olivier de Magny] / Bruno de Panafieu;Panafieu , Bruno de (Paris : B. Grasset, 1960);;;;Français;;;
L'Asie et la domination occidentale du XVe siècle à nos jours  ;Panikkar , Kavalam Madhava ;"L'Asie et la domination occidentale du XVe siècle à nos jours [Texte imprimé] / Kavalam Madhava Panikkar ; traduit de l'anglais par Paule et Ernest Bolo ; préface d'Albert Béguin";Panikkar , Kavalam Madhava (Paris : Ed. du Seuil, 1953);Asie -- Histoire   Asie   Relations  et autres;;;Français;;;
Bronis?aw Malinowski  ;Panoff , Michel ;Bronis?aw Malinowski [Texte imprimé] / Michel Panoff;Panoff , Michel (Paris : Payot, DL 1972, cop. 1972);Malinowski, Bronis?aw -- 1884-1942 ;"Petite bibliothèque Payot ; 195";;Français;;;
Ethnologie, le deuxième souffle  ;Panoff , Michel ;Ethnologie, le deuxième souffle [Texte imprimé] / Michel Panoff;"Panoff , Michel (Paris : Payot, 1977 ;  18-Saint-Amand :  impr. Bussière)";Ethnologie   Philosophie   Ethnologie -- Méthodologie ;"Petite bibliothèque Payot ; 302";;Français;2-228-33020-5 ;9782228330206 ;
La peinture byzantine et russe  ;Papaioannou , Kostas ;La peinture byzantine et russe [Texte imprimé] / Kostas Papaioannou;Papaioannou , Kostas (Lausanne : Ed. Rencontre, cop. 1965);Peinture -- Russie   Peinture byzantine   Peinture russe ;Histoire intégrale de l'art;;Français;;;
François-les-oiseaux :  ;Paradis , Suzanne ;François-les-oiseaux : [nouvelles] / Suzanne Paradis;"Paradis , Suzanne (Ottawa : Éditions Garneau ; 1967)";Littérature canadienne de langue française -- 1945-1970 ;;;Français;;;
Recherches sur la nature et les fonctions du langage ;Parain , Brice ;Recherches sur la nature et les fonctions du langage / Brice Parain;"Parain , Brice (Paris : Gallimard, DL [1972] ; C 1942)";Dialectique   Philosophie du langage   Knowledge, Theory of ;"Collection Idées ; 265";;Français;2-07-035265-X ;9782070352654 ;
Vivre à l'oblique  ;Parent , Claude ;Vivre à l'oblique [Texte imprimé] / Claude Parent;Parent , Claude ([s.l] : Claude Parent, cop.1970);;L'aventure urbaine;;Français;;;
Conversations sur l'esthétique  ;Pareyson , Luigi ;"Conversations sur l'esthétique [Texte imprimé] / Luigi Pareyson ; traduit de l'italien et préfacé par Gilles A. Tiberghien";"Pareyson , Luigi ([Paris] : Gallimard, impr. 1992 ;  18-Saint-Amand :  Impr. SEPC)";Esthétique   Littérature -- Esthétique ;Bibliothèque de philosophie;;Français;2-07-072517-0 ;9782070725175 ;
Hamlet ou les personnages du fils  ;Paris , Jean ;Hamlet ou les personnages du fils [Texte imprimé] / Jean Paris;Paris , Jean (Paris : Seuil, impr. 1953);Hamlet   Shakespeare, William   Shakespeare, William (1564-1616) -- Hamlet -- Personnages -- 1564-1616 -- personnage légendaire ;Pierres vives;;Français;;;
Maurice Roche  ;Paris , Jean ;Maurice Roche [Texte imprimé] / par Jean Paris;"Paris , Jean (Paris : Seghers, 1989 ;  53-Mayenne :  Impr. Floch)";Roche, Maurice -- 1924-1997 ;"Poètes d'aujourd'hui ; 259";;Français;2-232-10142-8 ;9782232101427 ;
Univers parallèles . 1 . Théâtre  ;Paris , Jean ;Univers parallèles . 1 . Théâtre [Texte imprimé] / Jean Paris;"Paris , Jean (Paris : Éd. du Seuil, cop. 1975 ;  27-Évreux :  impr. Hérissey)";Shakespeare, William   Théâtre (genre littéraire) -- 1564-1616 ;Collection Pierres vives;;Français;;;
Rabelais au futur ;Paris , Jean ;Rabelais au futur / Jean Paris;Paris , Jean (Paris : Éditions du Seuil, DL 1970);Rabelais, François   Rabelais, François -- ca. 1490-1553? -- Critique et interprétation -- 1494?-1553 ;Change;;Français;;;
"Hamlet et Panurge ; suivi de Entretiens du Cercle Polivanov ";Paris , Jean ;"Hamlet et Panurge ; suivi de Entretiens du Cercle Polivanov / Jean Paris";Paris , Jean (Paris : Éditions du Seuil, DL 1971);Rabelais, François   Shakespeare, William   Shakespeare, William (1564-1616) -- Hamlet  et autres;Change;;Français;;;
Le complexe de Filacciano  : essai sur la dépolitisation ;Parmelin , Hélène ;Le complexe de Filacciano [Texte imprimé] : essai sur la dépolitisation / Hélène Parmelin;Parmelin , Hélène (Paris : R. Julliard, 1960);;;;Français;;;
Libérez les communistes!  ;Parmelin , Hélène ;Libérez les communistes! [Texte imprimé] / Hélène Parmelin;Parmelin , Hélène (Paris : Stock : Opera Mundi, c1979);Communisme   Communistes   France  et autres;;;Français;2-234-01078-0 ;9782234010789 ;
Picasso sur la place ;Parmelin , Hélène ;Picasso sur la place / Hélène Parmelin;Parmelin , Hélène (Paris : René Julliard, DL 1959);Picasso, Pablo   Critique et interprétation -- 1881-1973 -- 1881-1973 ;;;Français;;;
Les Pensées de Pascal ;Pascal , Blaise ;Les Pensées de Pascal / éditées par Francis Kaplan;Pascal , Blaise (Paris : Les Éditions du Cerf, 1982);Catholic Church -- Apologetic works   Pascal, Blaise (1623-1662) -- Pensées   Apologetics -- Early works to 1800 ;;;Français;2-204-01846-5 ;9782204018463 ;
Lignes de fuite  : écrits, 1979-1989 ;Pascal , Philippe , poète ;Lignes de fuite [Texte imprimé] : écrits, 1979-1989 / Philippe Pascal;Pascal , Philippe , poète (Paris : Coprah, cop. 1990);Rock (musique)   France   1970-.... ;;;Français;;;
Prisonnier de Mao  : sept ans dans un camp de travail en Chine ;Pasqualini , Jean ;"Prisonnier de Mao [Texte imprimé] : sept ans dans un camp de travail en Chine / Jean Pasqualini ; avec la collaboration de Rudolph Chelminski ; traduit de l'anglais par Alain Delahaye";"Pasqualini , Jean ([Paris] : Gallimard, impr. 1975 ;  27-Mesnil-sur-l'Estrée :  impr. Firmin-Didot)";Camps de concentration -- Chine   Histoire   Prisonniers  et autres;"Collection Témoins ; 42";;Français;2-07-029136-7 ;9782070291366 ;
Les incertitudes du langage  ;Paulhan , Jean ;"Les incertitudes du langage [Texte imprimé] / Jean Paulhan ; entretiens à la Radio avec Robert Mallet";Paulhan , Jean ([Paris] : Gallimard, impr. 1970);Linguistique ;"Collection Idées ; 226";;Français;2-07-035226-9 ;9782070352265 ;
Les gens du riz : Kissi de Haute-Guinée française ;Paulme , Denise ;Les gens du riz : Kissi de Haute-Guinée française / Denise Paulme,...;Paulme , Denise (Paris : Librairie Plon, DL1954);Ethnologie -- Guinée   Riziculture   Guinée  et autres;"Recherches en Sciences Humaines ; 4";;Français;;;
La mère dévorante : essai sur la morphologie des contes africains ;Paulme , Denise ;La mère dévorante : essai sur la morphologie des contes africains / Denise Paulme;"Paulme , Denise ([Paris] : Gallimard, impr. 1976 ; C 1976 ; 27-Mesnil-sur-l'Estrée : impr. Firmin-Didot)";Tradition orale   Afrique   Mères  et autres;Bibliothèque des sciences humaines;;Français;;;
Le livre des pérégrinations  ;Paustovskij , Konstantin Georgievi? ;"Le livre des pérégrinations [Texte imprimé] / Constantin Paoustovski ; traduit du russe par Lydia Delt et Paule Martin";Paustovskij , Konstantin Georgievi? ([Paris] : Gallimard, impr. 1967);;"L'histoire d'une vie ; 6 .- Litteratures soviétiques ; 33";;Français;;;
Incursion dans le sud  ;Paustovskij , Konstantin Georgievi? ;"Incursion dans le sud [Texte imprimé] / Constantin Paoustovski ; traduit du russe par Lydia Delt et Paule Martin";Paustovskij , Konstantin Georgievi? ([Paris] : Gallimard, impr. 1966);;"L'histoire d'une vie ; 5 .- Littératures soviétiques ; 30";;Français;;;
Blumroch l'admirable ou le Déjeuner du surhomme  ;Pauwels , Louis ;Blumroch l'admirable ou le Déjeuner du surhomme [Texte imprimé] / Louis Pauwels;"Pauwels , Louis ([Paris] : Gallimard, 1976 ;  53-Mayenne :  impr. Floch)";;;;Français;2-07-029364-5 ;9782070293643 ;
Le Château du dessous  : roman ;Pauwels , Louis ;Le Château du dessous [Texte imprimé] : roman / Louis Pauwels;Pauwels , Louis ([Paris] : Gallimard, 1952);;;;Français;;;
Travailler fatigue  La Mort viendra et elle aura tes yeux : poésies variées ;Pavese , Cesare ;"Travailler fatigue [Texte imprimé] La Mort viendra et elle aura tes yeux : poésies variées / Cesare Pavese ; préface de Dominique Fernandez ; traduit de l'italien par Gilles de Van";"Pavese , Cesare ([Paris] : Gallimard, impr. 1979 ;  27-Mesnil-sur-l'Estrée :  impr. Firmin-Didot)";;"Collection Poésie ; 128";;Français;2-07-032180-0 ;9782070321803 ;
La Confédération des syndicats de Yougoslavie  ;Pavitchévitch , M. ;La Confédération des syndicats de Yougoslavie [Texte imprimé] / M. Pavitchévitch...;Pavitchévitch , M. (Belgrade : Conseil Central de la Confédération des syndicats de Yougoslavie, 1949);;;;Français;;;
Promenons-nous dans Paris  : Ile de la cité, rive gauche ;Payen-Appenzeller , Pascal ;Promenons-nous dans Paris [Texte imprimé] : Ile de la cité, rive gauche / Pascal et France Payen-Appenzeller;Payen-Appenzeller , Pascal (Paris : Princesse, D.L. 1980);Paris (France)   Guides ;;;Français;2-85961-083-9 ;9782859610838 ;
Renga : poème ;Paz , Octavio ;"Renga : poème / par Octavio Paz, Jacques Roubaud, Edoardo Sanguineti et Charles Tomlinson ; présenté par Claude Roy";Paz , Octavio ([Paris] : Gallimard, DL 1971);Renga   Anthologies ;;;"Français; Anglais; Espagnol; Italien";;;
Valérie ou l'œil profane  ;Pedretti , Erica ;"Valérie ou l'œil profane [Texte imprimé] / Erica Pedretti ; trad. de l'allemand par Olivier Mannoni";"Pedretti , Erica (Paris : Écriture, 1992 ;  77-Courtry :  Impr. Sagim)";;;;Français;2-909240-03-7 ;9782909240039 ;
Omnibus  ;Peeters , Benoît ;Omnibus [Texte imprimé] / Benoît Peeters;Peeters , Benoît (Paris : Ed. de Minuit, impr.1976);;;;Français;2-7073-0139-6 ;9782707301390 ;
Prières  ;Péguy , Charles ;Prières [Texte imprimé] / Charles Péguy;Péguy , Charles (Paris : Gallimard, impr. 1941);;;102e éd.;Français;;;
Les tapisseries  ;Péguy , Charles ;Les tapisseries [Texte imprimé] / Charles Péguy;Péguy , Charles ([Paris] : Gallimard, 1968);;"Poésie ; 35";;Français;;;
Constance  : Jéromiades II ;Peignot , Jérôme ;Constance [Texte imprimé] : Jéromiades II / Jérôme Peignot;Peignot , Jérôme (Paris : Ed. du seuil, 1959);;;;Français;;;
Camille Renault (1866-1954)  : world-maker ;Peillet , Emmanuel ;Camille Renault (1866-1954) [Texte imprimé] : world-maker / by J.H. Sainmont, provéditeur général adjoint et rogateur du Collège de pataphysique;Peillet , Emmanuel (London : Gaberbocchus Press, 1957, cop. 1957);Renault, Camille -- 1866-1954 ;"Gaberbocchus black series ; 10";;Anglais;;;
Danse et enseignement  : quel corps ? ;Peix-Arguel , Mireille ;Danse et enseignement [Texte imprimé] : quel corps ? / Mireille Peix-Arguel;"Peix-Arguel , Mireille (Paris : Vigot, DL 1980 ;  Paris :  impr. Jouve)";Danse -- Étude et enseignement ;"Collection Sport plus enseignement ; 37";;Français;2-7114-0785-3 ;9782711407859 ;
Palais de justice  ;Péju , Sylvie ;Palais de justice [Texte imprimé] / Sylvie Péju;"Péju , Sylvie (Paris : Éd. du Seuil, 1987 ;  27-Évreux :  Impr. Hérissey)";Justice -- Administration   France   Paris (France) -- Palais de Justice ;"L'Epreuve des faits ; 19";;Français;2-02-009612-9 ;9782020096126 ;
Ma mère l'Algérie  ;Pélégri , Jean ;Ma mère l'Algérie [Texte imprimé] / Jean Pélégri;Pélégri , Jean (Alger : Laphomic, 1989);Pieds-noirs   Biographies   Algérie  et autres;;;Français;;;
La Femme au temps des cathédrales ;Pernoud , Régine ;La Femme au temps des cathédrales / Régine Pernoud;Pernoud , Régine (Paris : Stock, DL 1980);Women -- France -- History -- Middle Ages, 500-1500   Social history -- Medieval, 500-1500   Europe  et autres;;;Français;2-234-00947-2 ;9782234009479 ;
La vie privée  : roman ;Perret , Vivette ;La vie privée [Texte imprimé] : roman / Vivette Perret;Perret , Vivette (Paris : Gallimard, 1953);;;;Français;;;
La Tresse  : roman ;Perret , Vivette ;La Tresse [Texte imprimé] : roman / Vivette Perret;Perret , Vivette (Paris : Gallimard, 1954);;;;Français;;;
Les Absents  : roman ;Perret , Vivette ;Les Absents [Texte imprimé] : roman / Vivette Perret;Perret , Vivette (Paris : Gallimard, 1958);;;;Français;;;
L'examen psychologique de l'enfant  ;Perron-Borelli , Michèle ;L'examen psychologique de l'enfant [Texte imprimé] / Michèle Perron-Borelli, Roger Perron;"Perron-Borelli , Michèle ([Paris] : Presses universitaires de France, 1973 ;  41-Vendôme :  Impr. des P.U.F.)";Enfants -- Tests psychologiques ;"Collection Sup . Le Psychologue ; 41";2e éd. revue et mise à jour;Français;;;
Le Mode de vie des familles bourgeoises  : 1873-1953 ;Perrot , Marguerite ;Le Mode de vie des familles bourgeoises [Texte imprimé] : 1873-1953 / Marguerite Perrot;Perrot , Marguerite (Paris : Presses de la Fondation nationale des sciences politiques, 1982);Bourgeoisie   Moeurs et coutumes   France  et autres;"Références ; 8";2 éd.;Français;2-7246-0468-7 ;9782724604689 ;
Indépendance de l'économie nationale et interdépendance des nations ;Perroux , François ;Indépendance de l'économie nationale et interdépendance des nations / François Perroux,...;Perroux , François (Paris : Aubier Montaigne, DL 1969);Autarcie   Relations économiques internationales   Autarchy  et autres;"Collection R. E. S. ; [13]";;Français;;;
La coexistence pacifique . III . Guerre ou partage du pain ? : les contradictions de l'armement et du développement : l'économie des hommes ;Perroux , François ;La coexistence pacifique . III . Guerre ou partage du pain ? : les contradictions de l'armement et du développement : l'économie des hommes / François Perroux;Perroux , François (Paris : Presses universitaires de France, 1958, copyright 1958);Relations internationales -- 1945-1989   Règlement pacifique des conflits internationaux   Relations économiques internationales  et autres;;;Français;;;
Saint Nicolas, mon bon Patron  ;Perry-Bouquet , Anne ;Saint Nicolas, mon bon Patron [Texte imprimé] / Anne Perry-Bouquet;"Perry-Bouquet , Anne (Paris : Stock, 1973 ;  27-Mesnil-sur-l'Estrée :  impr. Firmin-Didot)";;Théâtre ouvert;;Français;;;
The Englishness of English art  : an expanded and annotated version of the Reith Lectures broadcast in October and November 1955 ;Pevsner , Nikolaus ;The Englishness of English art [Texte imprimé] : an expanded and annotated version of the Reith Lectures broadcast in October and November 1955 / Nikolaus Pevsner;Pevsner , Nikolaus (Hardmondsworth : Penguin Books, 1964);Art -- Grande-Bretagne   Art anglais   Angleterre (GB)  et autres;"Peregrine Books ; 35";;Anglais;0-14-013738-6  et autres;9780140137385  et autres;
Histoire et légendes du Club Méditerranée  ;Peyre , Christiane ;Histoire et légendes du Club Méditerranée [Texte imprimé] / Christiane Peyre, Yves Raynouard;Peyre , Christiane (Paris : Éd. du Seuil, DL 1971);Club Méditerranée ;;;Français;;;
Nam et Sylvie  : roman ;Pham , Duy Khiêm ;Nam et Sylvie [Texte imprimé] : roman / Nam Kim;Pham , Duy Khiêm (Paris : Plon, impr. 1957);;;;Français;;;
L'échelle des âges ;Philibert , Michel ;L'échelle des âges / Michel Philibert;Philibert , Michel (Paris : Seuil, DL 1968);Âges de la vie   Vie   Vieillesse  et autres;L'ordre philosophique;;Français;;;
Biologie et connaissance  : essai sur les relations entre les régulations organiques et les processus cognitifs ;Piaget , Jean ;Biologie et connaissance [Texte imprimé] : essai sur les relations entre les régulations organiques et les processus cognitifs / Jean Piaget, ...;"Piaget , Jean ([Paris] : Gallimard, impr. 1973 ;  18-Saint-Amand :  impr. Bussière)";Biologie humaine   Psychologie cognitive   Théorie de la connaissance ;"Collection Idées ; 288";;Français;;;
Problèmes de psychologie génétique ;Piaget , Jean ;Problèmes de psychologie génétique / Jean Piaget;"Piaget , Jean (Paris : Denoël-Gonthier ; C 1972)";"Enfants -- Psychologie   Cognition -- Chez l&apos;enfant   France  et autres";"Bibliothèque Médiations ; 95";;Français;;;
Psychologie et pédagogie ;Piaget , Jean ;Psychologie et pédagogie / Jean Piaget;Piaget , Jean ([Paris] : Éditions Denoël?, DL 1969);"Psychologie de l&apos;éducation   Pédagogie   Psychology, Educational  et autres";"Bibliothèque médiations ; 59";;Français;2-07-032481-8 ;9782070324811 ;
La psychologie de l'intelligence  ;Piaget , Jean ;La psychologie de l'intelligence [Texte imprimé] / Jean Piaget, ...;Piaget , Jean (Paris : A. Colin, cop. 1967);Intelligence   Enfants -- Psychologie   Pensée ;"Collection U2 ; 29";;Français;;;
Où va l'éducation ;Piaget , Jean ;Où va l'éducation / Jean Piaget;"Piaget , Jean (Paris : Denoël/Gonthier, DL 1972 ; Biarritz : Imprimerie Cino Del Duca, 1972)";Éducation   Éducation -- Philosophie   Éducation -- Finalités  et autres;"Bibliothèque Médiations ; 100";;Français;;;
La carrière de Jean Racine  ;Picard , Raymond ;La carrière de Jean Racine [Texte imprimé] / par Raymond Picard;Picard , Raymond ([Paris] : Gallimard, 1956);Racine, Jean   Biographies -- 1639-1699 ;Bibliothèque des idées;[Nouv. édition revue et augmentée];Français;;;
De Racine au Parthénon : essais sur la littérature et l'art à l'âge classique ;Picard , Raymond ;"De Racine au Parthénon : essais sur la littérature et l'art à l'âge classique / Raymond Picard ; préface de Thierry Maulnier";Picard , Raymond ([Paris] : Gallimard, DL 1977);Racine, Jean   French literature -- 17th century -- History and criticism   French literature -- 18th century -- History and criticism  et autres;Bibliothèque des idées;;Français;2-07-029571-0 ;9782070295715 ;
La peinture romane  ;Pichard , Joseph ;La peinture romane [Texte imprimé] / Joseph Pichard;Pichard , Joseph (Lausanne : Ed. Rencontre, 1965);Peinture romane ;"Histoire intégrale de l'art ; 6";;Français;;;
Un Homme en creux  ;Pichon , Jean-Charles ;Un Homme en creux [Texte imprimé] / Jean-Charles Pichon;"Pichon , Jean-Charles (Paris : Stock, 1973 ;  12-Millau :  impr. Maury)";;;;Français;;;
Panorama de la nouvelle littérature française  ;Picon , Gaëtan ;Panorama de la nouvelle littérature française [Texte imprimé] / Gaétan Picon;Picon , Gaëtan ([Paris] : Gallimard, 1976);Littérature française -- 20e siècle   Histoire et critique ;;Nouvelle éd. revue et corrigée;Français;;;
Les Fronts silencieux  ;Piédoue , Michel ;Les Fronts silencieux [Texte imprimé] / Mchel Piédoue;Piédoue , Michel (Paris : Gallimard, 1968);;;;Français;;;
Zoé des ténèbres  : suivi de La révolution de Gaston Dubois ;Piédoue , Michel ;Zoé des ténèbres [Texte imprimé] : suivi de La révolution de Gaston Dubois / Michel Piédoue;Piédoue , Michel (Paris : Gallimard, 1967);;N.R.F.;;Français;;;
Entretiens avec Pierre Schaeffer  ;Pierret , Marc ;Entretiens avec Pierre Schaeffer [Texte imprimé] / Marc Pierret;Pierret , Marc (Paris : P. Belfond, [1969]);Schaeffer, Pierre   Entretiens -- 1910-1995 ;Entretiens;;Français;;;
Le divan romancier  ;Pierret , Marc ;"Le divan romancier [Texte imprimé] / Marc Pierret . précédé de L'Amateur amaté / de Félix Guattari ; dessins réalisés par Michèle Pierret";Pierret , Marc (Paris : C. Bourgois, impr. 1975);;;;Français;;;
Mascarets  ;Pieyre de Mandiargues , André ;Mascarets [Texte imprimé] / André Pieyre de Mandiargues;Pieyre de Mandiargues , André ([Paris] : Gallimard, 1971);;"Collection Soleil ; 289 .- Le Chemin";;Français;2-07-027813-1  et autres;9782070278138  et autres;
Un document inédit sur la Tunisie au XVIIe siècle  ;Pignon , Jean ;Un document inédit sur la Tunisie au XVIIe siècle [Texte imprimé] / Jean Pignon;Pignon , Jean ([Paris] : Presses universitaires de France, 1963);Tunisie -- 1574-1705 (Régence ottomane) ;"Publications de l'Université de Tunis, Faculté des lettres et sciences humaines . 5me Série : Sources de l'histoire tunisienne ; 3";;Français;;;
Les Gitans  ;Piguet , Jean-Claude ;Les Gitans [Texte imprimé] / Jean-Claude Piguet;Piguet , Jean-Claude ([Paris] : Ed. de minuit, 1959);;;;Français;;;
Nocturnes  ;Piguet , Jean-Claude ;Nocturnes [Texte imprimé] / Jean-Claude Piguet;Piguet , Jean-Claude ([S.l.] : Les Cahiers du gerfaut, 19XX);;;;Français;;;
Hamlet  : anatomia de la ambigüedad ;Pimstein , Felipe ;Hamlet [Texte imprimé] : anatomia de la ambigüedad / Felipe Pimstein;Pimstein , Felipe (Santiago de Chile : Andres Bello, cop. 1972);;;;Espagnol;;;
La France . 1 . Les conditions naturelles et humaines  ;Pinchemel , Philippe ;La France . 1 . Les conditions naturelles et humaines [Texte imprimé] / Philippe Pinchemel, ...;Pinchemel , Philippe (Paris : A. Colin, cop. 1969);France   Géographie ;;3e édition, remaniée et mise à jour, 1969;Français;;;
La France . 2 . Les milieux : campagnes, industrie et villes  ;Pinchemel , Philippe ;La France . 2 . Les milieux : campagnes, industrie et villes [Texte imprimé] / Philippe Pinchemel, ...;Pinchemel , Philippe (Paris : A. Colin, 1969);France   Géographie ;;3e éd., remaniée et mise à jour 1969;Français;;;
L'amour triste et autres textes  ;Pingaud , Bernard ;L'amour triste et autres textes [Texte imprimé] / par Bernard Pingaud . suivi de Les yeux ouverts / par Jean Roudaut;Pingaud , Bernard (Paris : Union générale d'éditions, impr. 1965);;"Le monde en 10/18 ; 231/232";;Français;;;
Entretiens avec Bernard Pingaud  ;Pingaud , Bernard ;Entretiens avec Bernard Pingaud [Texte imprimé] / Brice Parain;Pingaud , Bernard (Paris : Gallimard, impr. 1966);Pingaud, Bernard   Entretiens -- 1923-.... ;;;Français;;;
Le fiston  ;Pinget , Robert ;Le fiston [Texte imprimé] / Robert Pinget;Pinget , Robert (Paris : Ed. de Minuit, 1959);;;;Français;;;
Méthodes des sciences sociales  ;Pinto , Roger ;Méthodes des sciences sociales [Texte imprimé] / par Roger Pinto et Madeleine Grawitz;Pinto , Roger ([Paris] : Dalloz, 1971);;Précis Dalloz;4. éd.;Français;;;
Traité du zen et de l'entretien des motocyclettes : récit ;Pirsig , Robert M. ;"Traité du zen et de l'entretien des motocyclettes : récit / Robert M. Pirsig ; trad. de l'américain par Maurice Pons, Andrée et Sophie Mayoux ; préf. d'Octave Mannoni";"Pirsig , Robert M. (Paris : Éd. du Seuil, DL1978 ;  37-Tours :  Impr. Mame)";Autobiographie américaine ;"Points. Roman ; 151";;Français;2-02-006807-9 ;9782020068079 ;
L'animation socio-culturelle  : espace d'affrontement idéologique ;Pirson-De Clercq , Jacqueline ;"L'animation socio-culturelle [Texte imprimé] : espace d'affrontement idéologique / Jacqueline Pirson-de-Clercq... Ronald Pirson ; préface de Henri Janne";"Pirson-De Clercq , Jacqueline (Paris : F. Nathan ; Bruxelles : Ed. Labor, 1977)";Animation socio-culturelle ;Recherche et action culturelle-éducation permanente;;Français;2-8259-0046-X ;9782825900468 ;
Montage  ;Pittolo , Véronique ;Montage [Texte imprimé] / Véronique Pittolo;"Pittolo , Véronique ([Paris] : Fourbis, 1992 ;  92-Châtillon :  Impr. SEG)";;Collection Biennale internationale des poètes en Val-de-Marne;;Français;2-907374-55-9 ;9782907374552 ;
Une histoire politique de l'armée . 2 . De De Gaulle à De Gaulle  : 1940-1967 ;Planchais , Jean ;Une histoire politique de l'armée . 2 . De De Gaulle à De Gaulle [Texte imprimé] : 1940-1967 / Jean Planchais;Planchais , Jean (Paris : Ed. du Seuil, DL 1967);Gaulle, Charles de   Armées   France  et autres;"L'histoire immédiate .- Une histoire politique de l'armée ; 2";;Français;;;
