Titre;Auteur;Infos biblios;Créateur / Éditeur;Sujet;Collection;Édition;Langue;ISBN;ISBN (13);ISSN
"Pratiques alimentaires et identités culturelles : actes du colloque ""Le patrimoine gastronomique du Vietnam"", Hanoi 23-24 septembre 1997 ";Colloque Le patrimoine gastronomique du Vietnam ;"Pratiques alimentaires et identités culturelles : actes du colloque ""Le patrimoine gastronomique du Vietnam"", Hanoi 23-24 septembre 1997 / sous la direction de J. P. Poulain ; [organisé par l'Université Toulouse-Le Mirail, le Centre national des sciences sociales et humaines du Vietnam, le Centre de l'Ecole française d'Extrème-Orient au Vietnam et l'Université d'Hué]";"Colloque Le patrimoine gastronomique du Vietnam (1997 ; Hanoi, Vietnam) (Hà N?i : Etudes vietnamiennes, 1997)";Ethnologie -- Vietnam   Gastronomie   Vietnam  et autres;;;Français;;;
Le Palais des Papes d'Avignon ;Colombe , Gabriel ;Le Palais des Papes d'Avignon / par le docteur Gabriel Colombe;Colombe , Gabriel (Paris : Henri Laurens, éditeur, 1939);Palace of the Popes -- Avignon, France   Avignon (Vaucluse) -- Palais des Papes   Histoire ;Petites Monographies des grands édifices de la France;Troisième édition;Français;;;
Sartre ou le parti de vivre  ;Colombel , Jeannette ;Sartre ou le parti de vivre [Texte imprimé] / Jeannette Colombel;Colombel , Jeannette (Paris : B. Grasset, 1981);Sartre, Jean-Paul   Biographies -- 1905-1980 ;;;Français;2-246-21251-0 ;9782246212515 ;
Lutte de classes à Dunkerque  : les morts, les mots, les appareils d'État ;Comité De Vigilance Sur Les Pratiques Policières. [Paris.] Groupe d'information sur la répression ;"Lutte de classes à Dunkerque [Texte imprimé] : les morts, les mots, les appareils d'État / [Comité de vigilance sur les pratiques policières, Groupe d'information sur la répression ; rédigé par Jean-Pierre Faye]";"Comité De Vigilance Sur Les Pratiques Policières. [Paris.] Groupe d'information sur la répression (Paris (32, rue du Fer-à-Moulin, 75005) : Éditions Galilée, impr. 1973 ;  86-Ligugé :  impr. Aubin)";Lutte des classes   France -- Dunkerque (France) ;"Cahiers Luttes ; 1";;Français;2-7186-0005-5 ;9782718600055 ;
Les lycéens gardent la parole  ;Comités d'action lycéens ;Les lycéens gardent la parole [Texte imprimé] / Comités d'action lycéens;Comités d'action lycéens (Paris : Ed. du Seuil, 1968);Enseignement   Lycées   France ;"Politique ; 23";;Français;;;
Bataille  ;Compagno , Giuliano ;Bataille [Texte imprimé] / Giuliano Compagno;Compagno , Giuliano (Pescara : Edizione Tracce, impr. 1994);;"Maestri Occulti ; 3";;Italien;;;
L'identità del nemico  : Drieu La Rochelle e il pensiero della collaborazione ;Compagno , Giuliano ;L'identità del nemico [Texte imprimé] : Drieu La Rochelle e il pensiero della collaborazione / Giuliano Compagno;Compagno , Giuliano (Napoli : Liguori, cop. 1993);Drieu La Rochelle, Pierre   Pensée politique et sociale -- 1893-1945 -- Critique et interprétation -- 1893-1945 ;Teoria & oggetti;;Italien;88-207-2242-9 ;9788820722425 ;
Oeuvres d'Auguste Comte . Tome III . Cours de philosophie positive . 3 . La philosophie chimique et la philosophie biologique;Comte , Auguste ;Oeuvres d'Auguste Comte . Tome III . Cours de philosophie positive . 3 . La philosophie chimique et la philosophie biologique;Comte , Auguste (Paris : Editions Anthropos, DL 19681968);Positivisme   Philosophie des sciences ;;;Français;;;
Oeuvres . Tome I . Cours de philosophie positive . 1er volume . Les préliminaires généraux et la philosophie mathématique  ;Comte , Auguste ;"Oeuvres . Tome I . Cours de philosophie positive . 1er volume . Les préliminaires généraux et la philosophie mathématique [Texte imprimé] / Auguste Comte ; introduction de Sylvain Pérignon";Comte , Auguste (Paris : Ed. Anthropos, 1968);Positivisme   Philosophie des sciences ;;;Français;;;
Oeuvres . Tome II . Cours de philosophie positive . 2e volume . La philosophie astronomique et la philosophie de la physique  ;Comte , Auguste ;Oeuvres . Tome II . Cours de philosophie positive . 2e volume . La philosophie astronomique et la philosophie de la physique [Texte imprimé] / Auguste Comte;Comte , Auguste (Paris : Ed. Anthropos, 1968);Positivisme   Philosophie des sciences ;;;Français;;;
Laure Conan  ;Conan , Laure ;Laure Conan [Texte imprimé] / textes choisis et présentés par Micheline Dumont, ...;"Conan , Laure (Paris ; Montréal : Fides, [impr. 1961, cop.1960])";;"Classiques canadiens ; 20";;Français;;;
Fokon'olona et collectivités rurales en Imerina  ;Condominas , Georges ;"Fokon'olona et collectivités rurales en Imerina [Texte imprimé] / Georges Condominas ; préface du gouverneur Hubert Deschamps";Condominas , Georges (Paris : Berger-Levrault, 1960);Villages   Communautés rurales   Paysannerie  et autres;"L'Homme d'Outre-Mer . Nouvelle Série ; no 4";;Français;;;
L'exotique est quotidien : Sar-Luk, Vietnam central ;Condominas , Georges ;L'exotique est quotidien : Sar-Luk, Vietnam central / par Georges Condominas;Condominas , Georges (Paris : Plon, 1977, cop. 1965);"Mnong (Vietnamese people)   Mnong (peuple d&apos;Asie du Sud-Est)   Anthropologie  et autres";Terre humaine;Nouv. ed. augmentée d'une postface;Français;2-259-00152-1 ;9782259001526 ;
La Flèche d'or : un récit entre deux notes  ;Conrad , Joseph ;"La Flèche d'or : un récit entre deux notes [Texte imprimé] / Joseph Conrad ; trad. de l'anglais par G. Jean-Aubry";Conrad , Joseph (Paris : Gallimard, 1929);;;21ème édition;Français;;;
The protection of cultural property  : handbook of national legislations ;Conseil international des musées ;The protection of cultural property [Texte imprimé] : handbook of national legislations / compiled by Bonnie Burnham;Conseil international des musées (Paris : ICOM, 1974);"Droit d&apos;auteur   Patrimoine culturel -- Droit ";;;Anglais;;;
Code des usages  : Négociations Syndicat Nationale de l'Edition;Conseil permanent des écrivains ;"Code des usages [Texte imprimé] : Négociations Syndicat Nationale de l'Edition/Conseil Permanent des Ecrivains / Conseil Permanent des Ecrivains ; Syndicat National de l'Edition";Conseil permanent des écrivains (France) (Paris : Cercle de la librairie, 1981);;;;Français;;;
Ouregano  ;Constant , Paule ;Ouregano [Texte imprimé] / Paule Constant;Constant , Paule (Paris : Gallimard, 1980);;;;Français;;;
Hindouisme et bouddhisme  ;Coomaraswamy , Ananda Kentish ;"Hindouisme et bouddhisme [Texte imprimé] / Ananda K. Coomaraswamy ; trad. de l'anglais par René Allar et Pierre Ponsoye";Coomaraswamy , Ananda Kentish ([Paris] : Gallimard, 1963);Hindouisme   Bouddhisme ;"Idées ; 22";;Français;;;
Langage de la folie  : exploration dans l'hinterland de la révolution ;Cooper , David ;"Langage de la folie [Texte imprimé] : exploration dans l'hinterland de la révolution / David Cooper ; trad. de l'anglais par Nicole Frey et Bernard de Fréminville";"Cooper , David (Paris : Éditions du Seuil, DL 1978 ;  18-Saint-Amand :  impr. Bussière)";Maladies mentales   Antipsychiatrie   Schizophrénie ;Combats;;Français;2-02-004820-5 ;9782020048200 ;
Qui sont les dissidents  ;Cooper , David ;Qui sont les dissidents [Texte imprimé] / David Cooper;"Cooper , David (Paris : Éd. Galilée, 1977 ;  14-Condé-sur-Noireau :  impr. C. Corlet)";Radicalisme -- France ;"Débats ; 2";;Français;2-7186-0071-3 ;9782718600710 ;
Psychiatrie et anti-psychiatrie  ;Cooper , David ;"Psychiatrie et anti-psychiatrie [Texte imprimé] / David Cooper ; traduit de l'anglais par Michel Braudeau";Cooper , David (Paris : Éd. du Seuil, Impr. 1970);Schizophrénie   Psychiatrie   Antipsychiatrie ;"Le Champ freudien ; 8";;Français;2-02-002758-5 ;9782020027588 ;
Une grammaire à l'usage des vivants  : essai sur les actes politiques ;Cooper , David ;"Une grammaire à l'usage des vivants [Texte imprimé] : essai sur les actes politiques / David Cooper ; traduit de l'anglais par Michel Braudeau";"Cooper , David (Paris : Éditions du Seuil, 1976 ;  18-Saint-Amand :  impr. Bussière)";Antipsychiatrie   Psychiatrie   Philosophie ;Collection Combats;;Français;2-02-004319-X ;9782020043199 ;
Le Village à l'heure de la télé ;Corbeau , Jean-Pierre ;"Le Village à l'heure de la télé / Jean-Pierre Corbeau ; avec la collaboration de Martine Bréard, de Dan Franck et des gens du village";"Corbeau , Jean-Pierre (Paris : Stock, 1978 ;  86-Ligugé :  impr. Aubin)";Télévision -- Aspect social   France -- Conditions sociales ;Les Grands sujets;;Français;2-234-00368-7 ;9782234003682 ;
Retour à Leipzig  : Roman ;Cordelier , Jean ;Retour à Leipzig [Texte imprimé] : Roman / Jean Cordelier;Cordelier , Jean (Paris : Editions du Seuil, Impr.1957);;;;Français;;;
L'humour d'expression française : acte du , Paris 27-30 juin 1988;CORHUM . Congrès ;L'humour d'expression française : acte du [1er] colloque international [organisé par CORHUM et l'université de Paris VIII], Paris 27-30 juin 1988;"CORHUM . Congrès (1 ; 1988 ; Paris) (Nice : Zéditions, 1990)";Histoires drôles françaises   Français (langue)   Humour  et autres;Humoresques;;Français;2-87720-051-5  et autres;9782877200516  et autres;
Histoire de l'Afrique : des origines à la deuxième guerre mondiale ;Cornevin , Robert ;Histoire de l'Afrique : des origines à la deuxième guerre mondiale / Robert et Marianne Cornevin;Cornevin , Robert (Paris : Payot, DL 1970);Afrique -- Histoire ;"Petite bibliothèque Payot ; 158";3e édition revue et mise à jour;Français;;;
Teoria e sociologia dell'arte  : con un saggio su P. Picasso ;Costa , Mario ;Teoria e sociologia dell'arte [Texte imprimé] : con un saggio su P. Picasso / Mario Costa;Costa , Mario (Naples : Guida, impr. 1974);"Picasso, Pablo   Sociologie de l&apos;art -- Critique et interprétation -- 1881-1973 ";"Collana la Spirale ; 8";;Italien;;;
Citoyens et candidats  : la pratique des élections ;Cot , Jean-Pierre ;Citoyens et candidats [Texte imprimé] : la pratique des élections / Jean-Pierre Cot et Pierre Gaborit;"Cot , Jean-Pierre (Paris : R. Laffont, Impr. 1977 ;  27-Mesnil-sur-l'Estrée :  impr. Firmin-Didot)";Élections   Droit électoral   France ;Défense d'ignorer;;Français;;;
Pour une sociologie politique  ;Cot , Jean-Pierre ;Pour une sociologie politique [Texte imprimé] / Jean-Pierre Cot, Jean-Pierre Mounier;Cot , Jean-Pierre (Paris : Ed. du Seuil, 1974);Sociologie politique ;"Points. Politique ; 65 ; 66";;Français;2-02-005195-8  et autres;9782020051958  et autres;
Le voyage d'hiver  : récit ;Coudol , Jacques ;Le voyage d'hiver [Texte imprimé] : récit / Jacques Coudol;Coudol , Jacques (Paris : Ed. du Seuil, D.L. 1961);;;;Français;;;
Je suis lesbien  ;Coupry , François ;Je suis lesbien [Texte imprimé] / François Coupry;"Coupry , François ([Paris] : Balland, 1978 ;  18-Saint-Amand :  impr. Bussière)";;;;Français;2-7158-0159-9 ;9782715801592 ;
Ventre bleu  ;Coupry , François ;Ventre bleu [Texte imprimé] / François Coupry;Coupry , François ([Paris] : Balland, D.L 1978);;L'Instant romanesque;;Français;2-7158-0141-6 ;9782715801417 ;
Mille patte sans tête  : roman ;Coupry , François ;"Mille patte sans tête [Texte imprimé] : roman / François Coupry ; préface de Jean-Edern Hallier";Coupry , François ([Paris] : éd. Hallier, 1975);;;;Français;2-85785-004-2 ;9782857850045 ;
La terre ne tourne pas autour du soleil  ;Coupry , François ;La terre ne tourne pas autour du soleil [Texte imprimé] / François Coupry;Coupry , François ([Paris] : Gallimard, 1980);;;;Français;;;
La promenade cassée  ;Coupry , François ;La promenade cassée [Texte imprimé] / François Coupry;Coupry , François ([Paris] : Gallimard, 1970);;;;Français;;;
La Soupe chinoise  ;Courchay , Claude ;La Soupe chinoise [Texte imprimé] / Claude Courchay;"Courchay , Claude ([Paris] : Gallimard, 1973 ;  86-Ligugé :  impr. Aubin)";;;;Français;2-07-028488-3 ;9782070284887 ;
Chroniques pour un cochon malade :  ;Courchay , Claude ;Chroniques pour un cochon malade : [récit] / Claude Courchay;"Courchay , Claude ([Paris] : Gallimard, DL 1974 ; 86-Ligugé : Imprimerie Aubin)";Professeurs (enseignement secondaire)   France   Récits personnels ;;;Français;;;
Enfants de la justice  ;Cournot , Michel ;Enfants de la justice [Texte imprimé] / Michel Cournot;Cournot , Michel (Paris : Gallimard, 1959);;L'Air du Temps;;Français;;;
Le drame du Fukuryu Maru  ;Cousin , Gabriel ;Le drame du Fukuryu Maru [Texte imprimé] / Gabriel Cousin;"Cousin , Gabriel (Paris : Gallimard, 1960 ;  Montrouge :  Impr. Moderne)";;Le Manteau d'Arlequin;;Français;;;
La beauté du reste  : confession d'un conservateur de musée sur la perfection et l'enfermement de la Suisse et des Alpes ;Crettaz , Bernard ;La beauté du reste [Texte imprimé] : confession d'un conservateur de musée sur la perfection et l'enfermement de la Suisse et des Alpes / Bernard Crettaz;Crettaz , Bernard (Carouge-Genève : Ed. Zoé, impr.1993);Mythe -- Aspect social   Ethnologie -- Suisse   Suisse -- Civilisation  et autres;"Collection Histoire . Série Paysages ; 2";;Français;2-88182-191-X ;9782881821912 ;
Cours de botanique  : organographie et familles naturelles : rédigé conformément aux nouveaux programmes por la classe de quatrième ... ;Crié , Louis ;Cours de botanique [Texte imprimé] : organographie et familles naturelles : rédigé conformément aux nouveaux programmes por la classe de quatrième ... / par Louis Crié;Crié , Louis (Paris : O. Doin, [1884?]);"Botanique   Manuels d&apos;enseignement secondaire -- Premier cycle ";;2e éd.;Français;;;
Les enfants de Poto-Poto  ;Croce-Spinelli , Michel ;Les enfants de Poto-Poto [Texte imprimé] / Michel Croce-Spinelli;Croce-Spinelli , Michel (Paris : Grasset, 1967);Afrique francophone   Moeurs et coutumes ;;;Français;;;
Usines et syndicats d'Amérique  ;Crozier , Michel ;Usines et syndicats d'Amérique [Texte imprimé] / Michel Crozier;Crozier , Michel (Paris : Les éd. ouvrières, impr. 1951);Syndicalisme   Mouvement ouvrier   Syndicats  et autres;Masses et militants;;Français;;;
La danse sacrée en Indochine et en Indonésie ;Cuisinier , Jeanne , ethnologue ;La danse sacrée en Indochine et en Indonésie / par Jeanne Cuisinier;Cuisinier , Jeanne , ethnologue (Paris : Presses universitaires de France, 1951, cop. 1951);Danse traditionnelle   Indochine   Danse -- Aspect religieux  et autres;"Mythes et religions ; 27";;Français;;;
La littérature des Etats-Unis ;Cunliffe , Marcus ;"La littérature des Etats-Unis / Marcus Cunliffe, .. ; traduit de l'anglais par A. de Lesguern";Cunliffe , Marcus (Paris : Presses Universitaires de France, 1964, cop.1964);American literature -- History and criticism   Littérature américaine   Histoire et critique ;;;Français;;;
Un homme perdu d'espoir  ;Cuny , Georges-Paul ;Un homme perdu d'espoir [Texte imprimé] / Georges-Paul Cuny;Cuny , Georges-Paul ([Paris] : Gallimard, 1978);;;;Français;;;
La Truite de Schubert  : suivi de Trio pour deux canaris ;Da Costa , Bernard ;La Truite de Schubert [Texte imprimé] : suivi de Trio pour deux canaris / Bernard Da Costa;"Da Costa , Bernard (Paris : Ed. P. Belfond, 1968 ;  Doullens (Somme) :  Impr. Dessaint)";;"Collection ""Café-théâtre""";;Français;;;
La Dépression dite nerveuse  ;Dabrowski , Richard ;La Dépression dite nerveuse [Texte imprimé] / Dr. Richard Dabrowski;"Dabrowski , Richard (Paris : R. Laffont, 1975 ;  45-Malesherbes :  impr. Maury)";Dépression nerveuse ;Collection Comprendre pour guérir;;Français;;;
Cent fleurs pour Wilhelm Reich  ;Dadoun , Roger ;Cent fleurs pour Wilhelm Reich [Texte imprimé] / Roger Dadoun;"Dadoun , Roger (Paris : Payot, 1975 ;  18-Saint-Amand :  impr. Bussière)";Reich, Wilhelm -- 1897-1957 ;Collection Traces;;Français;2-228-54040-4 ;9782228540407 ;
Naissance du désert  ;Dagron , Chantal ;Naissance du désert [Texte imprimé] / Chantal Dagron, Mohamed Kacimi;"Dagron , Chantal (Paris : Balland, 1992 ;  53-Mayenne :  Impr. Floch)";Déserts   Dans la littérature   Judaïsme  et autres;Naissance des imaginaires;;Français;2-7158-0965-4 ;9782715809659 ;
Fut bâti ;Daive , Jean ;Fut bâti / Jean Daive;"Daive , Jean ([Paris] : Gallimard, DL 1973 ; 53-Mayenne : impr. Floch)";Poésie française -- 20e siècle ;;;Français;2-07-028515-4 ;9782070285150 ;
Le socialisme du silence  : de l'histoire de l'U.R.S.S. comme secret d'État (1921-19..) ;Daix , Pierre ;Le socialisme du silence [Texte imprimé] : de l'histoire de l'U.R.S.S. comme secret d'État (1921-19..) / Pierre Daix;"Daix , Pierre (Paris : Éditions du Seuil, DL 1976 ;  80-Doullens :  impr. Aubin)";Communisme   URSS   Politique et gouvernement ;"Collection Combats ; 30";;Français;;;
Les activités créatrices de l'enfant  ;Dal Prato , Andrea ;"Les activités créatrices de l'enfant [Texte imprimé] / A. Dal Prato ; [Traduit par Guillemette de Beauvillé.]";Dal Prato , Andrea (Paris : H. Dessain et Tolra, 1970);Activités dirigées   Travaux manuels   Dessin ;;;Non défini;;;
Évariste Galois  : révolutionnaire et géomètre ;Dalmas , André ;Évariste Galois [Texte imprimé] : révolutionnaire et géomètre / André Dalmas;Dalmas , André (Paris : Fasquelle, 1956);Galois, Évariste   Biographies -- 1811-1832 ;Libelles;;Français;;;
La Forêt de Fontainebleau  : recherches sur son sol, sa faune, sa flore ;Dalmon , H. ;La Forêt de Fontainebleau [Texte imprimé] : recherches sur son sol, sa faune, sa flore / par le Dr H. Dalmon;Dalmon , H. (Moret-sur-Loing : Association des naturalistes de la vallée du Loing, 1932);Biogéographie   Fontainebleau, Forêt de (France) ;;;Français;;;
Cucubé  : opuscule ;Dam , René ;Cucubé [Texte imprimé] : opuscule / René Dam . avec un Point de Vue et quelques Petits conseils pour une grande époque / par Walter Kirchberger;Dam , René (Paris : Gizard éditeur, 1951);;;;Français;;;
Emilou : roman ;Dam , René ;Emilou : roman / René Dam;Dam , René ([Paris] : Bordas, c1946);;"Collection les Imaginaires ; 3";;Français;;;
Théorie du nuage : pour une histoire de la peinture ;Damisch , Hubert ;Théorie du nuage : pour une histoire de la peinture / Hubert Damisch;Damisch , Hubert (Paris : Éditions du Seuil, DL 1972);"Nuages   Dans l&apos;art   Art -- Thèmes, motifs ";;;Français;978-2-02-002711-3  et autres;978-2-02-002711-3  et autres;
Les petites sirène  ;Dangerfield , Yves ;Les petites sirène [Texte imprimé] / Yves Dangerfield;Dangerfield , Yves (Paris : B. Grasset, 1978);;;;Français;2-246-00568-X ;9782246005681 ;
Séraphin, l'ange tombé dans la rue  ;Danhaive , Louise-Marie ;"Séraphin, l'ange tombé dans la rue [Texte imprimé] / Louise-Marie Danhaive ; dessin de Jacqueline Hotton";Danhaive , Louise-Marie (Paris : Éditions de la Grisiére, D.L. 1971);;Collection Balises;;Français;;;
Dieu est-il fanatique ?  ;Daniel , Jean ;Dieu est-il fanatique ? [Texte imprimé] / Jean Daniel;"Daniel , Jean ([Paris] : Arléa, impr.1996 ;  27-Évreux :  Impr. Hérissey)";Daniel, Jean   Doute   Dans la littérature  et autres;;;Français;2-86959-272-8 ;9782869592728 ;
Le temps qui reste  : essai d'autobiographie professionnelle ;Daniel , Jean ;Le temps qui reste [Texte imprimé] : essai d'autobiographie professionnelle / Jean Daniel;Daniel , Jean ([Paris] : Stock, impr.1973);Daniel, Jean   Presse   France  et autres;Collection dirigée par Claude Glayman;;Français;;;
De Gaulle et l'Algérie : la tragédie, le héros et le témoin ;Daniel , Jean ;De Gaulle et l'Algérie : la tragédie, le héros et le témoin / Jean Daniel;Daniel , Jean (Paris : Éditions du Seuil, DL 1986);"Gaulle, Charles de   Politique et gouvernement -- Algérie -- 1945-1962   Algérie -- 1954-1962 (Guerre d&apos;Algérie) -- Dernières années -- 1890-1970 ";"L'Histoire immédiate ; 9";;Français;2-02-009229-8 ;9782020092296 ;
Les religions d'un président  : regards sur les aventures du mitterrandisme ;Daniel , Jean ;Les religions d'un président [Texte imprimé] : regards sur les aventures du mitterrandisme / Jean Daniel;"Daniel , Jean (Paris : B. Grasset, impr.1988 ;  18-Saint-Amand :  Impr. SEPC)";Mitterrand, François   Présidents -- France   Biographies  et autres;;;Français;2-246-39991-2 ;9782246399919 ;
Le Martyre de Saint Sébastien  : mystère composé en rythme français ;D'Annunzio , Gabriele ;"Le Martyre de Saint Sébastien [Texte imprimé] : mystère composé en rythme français / par Gabriele D'Annunzio ; et joué à Paris sur la scène du Châtelet le XXI mai MCMXI avec la musique de Claude Debussy";D'Annunzio , Gabriele (Paris : Calmann-Lévy, 1928);;;;Français;;;
Les victoires mutilées : trois tragédies ;D'Annunzio , Gabriele ;"Les victoires mutilées : trois tragédies / Gabriele d'Annunzio ; traduites de l'italien par G. Hérelle";D'Annunzio , Gabriele (Paris : Calmann-Lévy, [1921]);;;[27. ed.];Français;;;
L'enfant de volupté  ;D'Annunzio , Gabriele ;"L'enfant de volupté [Texte imprimé] / par Gabriele D'Annunzio ; traduit de l'italien par G. Herelle";D'Annunzio , Gabriele (Paris : Calmann Lévy, impr. 1926);;Les romans de la rose;;Français;;;
Teneo te Africa  : la seconda gesta d'oltremare ;D'Annunzio , Gabriele ;Teneo te Africa [Texte imprimé] : la seconda gesta d'oltremare / Gabriele D'Annunzio;D'Annunzio , Gabriele ([Roma] : Il Vittoriale degli Italiani, 1943);;"Opere ; 47";;Italien;;;
La Léda sans cygne  : récit de la lande : suivi d'un Envoi à la France ;D'Annunzio , Gabriele ;"La Léda sans cygne [Texte imprimé] : récit de la lande : suivi d'un Envoi à la France / Gabriele D'Annunzio ; traduit de l'italien par André Doderet";"D'Annunzio , Gabriele (Paris : Calmann-Lévy, 1922 ;  Coulommiers :  Impr; Paul Brodard)";;Aspects de l'inconnu;19è éd.;Français;;;
Poésies  : 1878-1893 ;D'Annunzio , Gabriele ;"Poésies [Texte imprimé] : 1878-1893 / Gabriele D'Annunzio ; trad. de l'italien par G. Hérelle";D'Annunzio , Gabriele (Paris : Calmann-Lévy, cop. 1912);;;;Français;;;
Les Vierges au rochers  ;D'Annunzio , Gabriele ;"Les Vierges au rochers [Texte imprimé] / par Gabriele d'Annunzio ; trad. de l'italien par G. Hérelle";D'Annunzio , Gabriele (Paris : Calmann-Lévy, 1926);;Les Romans du lys;;Français;;;
Episcopo et Cie  ;D'Annunzio , Gabriele ;"Episcopo et Cie [Texte imprimé] / G. d'Annunzio ; traduit de l'italien par G. Hérelle";D'Annunzio , Gabriele (Paris : Calmann-Lévy, [ca. 1921]);;Collection Nouvelle;19e éd.;Français;;;
Les Principales règles de l'orthographe étudiées méthodiquement  ;Dantel , F. ;Les Principales règles de l'orthographe étudiées méthodiquement [Texte imprimé] / F. Dantel;Dantel , F. (La Charité-sur-Loire : impr. A. Delayance, 1934);Français (langue)   Orthographe   Étude et enseignement  et autres;;;Français;;;
Féminisme et politique au Maghreb : (1930-1992) ;Daoud , Zakya ;Féminisme et politique au Maghreb : (1930-1992) / Zakya Daoud;Daoud , Zakya (Casablanca : EDDIF, impr 1993);Islam et politique   Femmes et islam   Musulmanes  et autres;Essai;;Français;2-908801-48-5 ;9782908801484 ;
Chronique d'Anafiotika... : roman . 1 . L'Enfant grecque ;Daraki , Maria ;Chronique d'Anafiotika... : roman . 1 . L'Enfant grecque / Maria Daraki;Daraki , Maria (Paris : Éditions du Seuil, 1966);Roman français ;;;Français;;;
Une philosophie de l'expérience  ;Darbon , André ;Une philosophie de l'expérience [Texte imprimé] / par André Darbon;Darbon , André (Paris : Presses universitaires de France, 1946);Expérience   Morale ;Bibliothèque de philosophie contemporaine . Histoire de la philosophie et philosophie générale;;Français;;;
Navires et marchandises dans les ports de Rouen et du Havre au XVIIIe siècle ;Dardel , Pierre ;"Navires et marchandises dans les ports de Rouen et du Havre au XVIIIe siècle / Pierre Dardel ; École pratique des hautes études, VIe Section, Centre de recherches historiques";Dardel , Pierre (Paris : SEVPEN, 1963);Commerce   Navigation   Navires de commerce  et autres;"Ports, routes, trafics ; 15";;Français;2-7132-0341-4 ;9782713203411 ;
Le soleil luit quand même  : roman ;Darov , Anatoli Andreevitch ;"Le soleil luit quand même [Texte imprimé] : roman / Anatole Daroff ; traduit du russe et annoté par Eliane Moch-Bickert";Darov , Anatoli Andreevitch (Paris : Gallimard, 1959);;Du monde entier;;Français;2-07-021752-3 ;9782070217526 ;
La Maye... ;Darras , Jacques ;La Maye... / Jacques Darras;Darras , Jacques (Amiens : 3 cailloux, DL 1988);;1 nuit 3 cailloux;;Français;2-903082-39-1 ;9782903082390 ;
Joseph Conrad  ;Darras , Jacques ;"Joseph Conrad [Texte imprimé] / Jacques Darras, texte ; photographies, Jorge Molder";"Darras , Jacques (Paris : Marval, 1991 ;  Paris :  Impr. Marchand)";Conrad, Joseph   Critique et interprétation -- 1857-1924 ;Lieux de l'écrit;;Français;2-86234-091-X ;9782862340913 ;
Le Génie du Nord ;Darras , Jacques ;Le Génie du Nord / Jacques Darras;Darras , Jacques (Paris : Bernard Grasset, DL 1988);Darras, Jacques   Écrivains -- Résidences et lieux familiers   Europe du Nord  et autres;;;Français;2-246-40491-6  et autres;9782246404910  et autres;
Pour une psychiatrie de l'ellipse  : les aventures du sujet en création ;Darrault-Harris , Ivan ;"Pour une psychiatrie de l'ellipse [Texte imprimé] : les aventures du sujet en création / Ivan Darrault-Harris, Jean-Pierre Klein ; postf. de Paul Ricoeur ; préf. de Jean Duvignaud";"Darrault-Harris , Ivan (Paris : Presses universitaires de France, 1993 ;  41-Vendôme :  Impr. des PUF)";Psychiatrie   Recherche   Enfants -- Psychothérapie  et autres;Formes sémiotiques;;Français;2-13-045532-8 ;9782130455325 ;
Le Prestige du passé  ;Dasnoy , Albert ;Le Prestige du passé [Texte imprimé] / Albert Dasnoy;Dasnoy , Albert ([Paris] : Gallimard, impr. 1959);;;;Français;;;
